MCQ,Choices,Correct
What is machine learning?,a: The study of statistical algorithms in artificial intelligence | b: The study of computer vision and speech recognition | c: The study of data mining and exploratory data analysis | d: The study of mathematical optimization methods,a
Who coined the term 'machine learning'?,a: Arthur Samuel | b: Donald Hebb | c: Walter Pitts | d: Raytheon Company,a
What was the early machine learning model developed by Arthur Samuel used for?,a: Checkers | b: Sonar signals | c: Speech patterns | d: Medical diagnosis,a
What is the relationship between machine learning and artificial intelligence?,a: Machine learning is a subfield of AI | b: AI and machine learning are unrelated | c: AI is a subfield of machine learning | d: AI and machine learning have no relationship,a
In which decade did machine learning start to flourish as its own field?,a: 1950s | b: 1960s | c: 1970s | d: 1990s,d
